<?xml version="1.0" encoding="UTF-8"?>
<!DOCTYPE library SYSTEM "../library.dtd">
<library name="Juan">
  <counter>3</counter>
  <cards>
    <magazinCard reference="r1111111111" order="2" year="2000" num="15">
      <title>Tiempo</title>
      <isLent>N</isLent>
      <creationDate>2024-10-13 11:25:56.005</creationDate>
      <modificationDate>N</modificationDate>
    </magazinCard>
    <bookCard isbn="" reference="r2222222222" order="1">
      <title>El Quixot</title>
      <isLent>N</isLent>
      <creationDate>2024-10-13 11:25:56.005</creationDate>
      <modificationDate>N</modificationDate>
      <editorial>N</editorial>
    </bookCard>
    <magazinCard reference="r3333333333" order="3" year="2010" num="3">
      <title>Mundo Cient√≠fico</title>
      <isLent>N</isLent>
      <creationDate>2024-10-13 11:25:56.005</creationDate>
      <modificationDate>N</modificationDate>
    </magazinCard>
  </cards>
</library>
